filename,pred_str
sample-000774.mp3,I WISHED I HAD A LIGHT TO SMOKE BY
sample-000775.mp3,IT MUST HAVE FALLEN WHILE I WAS SITTING OVER THERE
sample-000776.mp3,NOW I CAN SEE THAT IT HASN'T BEEN TOO BAD
sample-000777.mp3,MY MOTHER JUST CALLED YOU
sample-000778.mp3,HIRES TWO PERSONAL TRAINERS AND MAKE ONE OF THEM TRAIN THE OTHER ONE
sample-000779.mp3,WELL I'D LIKE TO SEE THEIR LAND AND SEE HOW THEY LIVE SAID HIS SON
sample-000780.mp3,IT'S A SIMPLE STORY
sample-000781.mp3,I SHALL MAKE US SOME ICE CUBES
sample-000782.mp3,THE THOMAS POFOND THED DOG TO WIK
sample-000783.mp3,BUT THE BOY WAS QUIET
sample-000784.mp3,THE ENGLISHMAN VANISHED TOO GAN TO FIND THE ALCHEMIST
sample-000785.mp3,I'M HUNTING WITH MY FALCON THE ALCHEMIST ANSWERED
sample-000786.mp3,AND I'M CERTAIN YOU'LL FIND IT THE ALCHEMIST SAID
sample-000787.mp3,ONE CAN IMAGINE THESE TWO COVERED WITH SUN WINDING UP THE LITTLE STREET IN THE BRIGHT SUNLIGHT
sample-000788.mp3,NOBODY KNEW WHO MALCOMP WAS
sample-000789.mp3,THE ITALIAN GOT HER WORDS MIXED UP
sample-000790.mp3,AND FIND OUT WHERE THE NEAREST TELEGRAPH OFFICE IS
sample-000791.mp3,I ALWAYS HAVE BEEN
sample-000792.mp3,OF COURSE THIS ONLY REDUCES THE SEVERITY OF THE PROBLEM
sample-000793.mp3,THEN WHY DO YOU SUPPOSE HE HASN'T AT LEAST CALLED UP
sample-000794.mp3,I'M ALREADY USED TO THE WAY THINGS ARE
sample-000795.mp3,THE PROCESS OF ENCRYPTING THE HASHVALUE OF A MASSEARCH IS CALLED DEGUTLE SIGNATURE
sample-000796.mp3,MY WIFE POINTED OUT TO ME THE BRIGHTNESS OF THE RED GREEN AND YELLOW SIGNAL LIGHTS
sample-000797.mp3,THE BOSS SENT ME OVER WITH IT
sample-000798.mp3,A TARNEL LIKE A DUCEY BRAIL
sample-000799.mp3,IT'S TRUE LIFE REALLY IS GENEROUS TO THOSE WHO PURSUE THEIR DESTINY THE BOY THOUGHT
sample-000800.mp3,EVERYONE SEEMED VERY EXCITED
sample-000801.mp3,I WON'T SHUT UP
sample-000802.mp3,THE TWO MEN HURRIED BACK AND FOUND THE CYLINDER STILL LYING IN THE SAME POSITION
sample-000803.mp3,THEN HE DROPPED HIS SPADE PICKED UP HIS JACKET AND CAME OUT INTO THE ROAD
sample-000804.mp3,I LOCKED IYE WITH A FISH IN A TANK
sample-000805.mp3,MY MIND RAN ON THE POSSIBILITIES OF ITS CONTENT
sample-000806.mp3,I HEARD WHAT YOU WERE TALKING ABOUT THE OTHER DAY WITH THE ALCHEMIST THE WIND SAID
sample-000807.mp3,YOU WANNA TAKE THIS OUTSIDE
sample-000808.mp3,HE BEGAN TO DIG AT THE BASE OF THE SYCAN WOR
sample-000809.mp3,YOU'RE IN LUCK YOU TWO THE FAT ARAB SAID
sample-000810.mp3,IT HAD A DIAMETER OF ABOUT THIRTY YARDS
sample-000811.mp3,I MYSELF HEARD NOTHING OF THAT
sample-000812.mp3,BUT ARMS CANNOT BE DRAWN UNLESS THEY ALSO GO INTO BATTLE
sample-000813.mp3,THE PEOPLE WERE ALSO PRAYING TO HEAVEN FOR PROTECTIO
sample-000814.mp3,THE OLD MAN GAVE A SIGNAL AND EVERYONE STOOD
sample-000815.mp3,LIKE EVERYBODY LEARNS HE SAID
sample-000816.mp3,YOU HAVE BEEN STOPPING ME
sample-000817.mp3,CAMELS ARE TREACHEROUS THEY WALK THOUSANDS OF PACES AND NEVER SEEM TO TIRE
sample-000818.mp3,IF I DON'T VANGE IT I CAN ALWAYS GO HOME
sample-000819.mp3,THEN SUDDENLY THEY KNEEL AND DIE
sample-000820.mp3,HE MOVED ABOUT INVISIBLE BUT EVERYONE COULD HEAR HIM
sample-000821.mp3,GOODBYE SAID THE BOY
sample-000822.mp3,THAT WOMAN IS GOIN NO BE ON THAT ROOF
sample-000823.mp3,THERE WERE RAISED VOICESAND SOME SORT OF STRUGGLE APPEARED TO BE GOING ON 
sample-000824.mp3,BESIDES THAT THERE WAS A HEAP OF BICYCLES
sample-000825.mp3,IS THERE A MRS JOSHUA
sample-000826.mp3,THE HORIZON WAS TINGED WITH RED AND SUDDENLY THE SUN APPEARED
sample-000827.mp3,AND IT GOES FOR YOU TOO
sample-000828.mp3,SUDDENLY THERE IS SO MUCH MORE TIME IN A DAY BECAUSE SHE NO LONGER HAS TO SPEND HOURS COMMUTING
sample-000829.mp3,I CAN'T QUITE HEAR YOU
sample-000830.mp3,THEY MOUNTED THEIR HORSES
sample-000831.mp3,NEVER GIVE UP
sample-000832.mp3,I'VE GOT THROUGH THE BATE HERE
sample-000833.mp3,THE NEXT THING THE DOBE ONS AS A WOOM
sample-000834.mp3,I'M AN OLD SUPERSTITIOUS ARAB AND I BELIEVE IN OUR PROVERBS
sample-000835.mp3,WHAT DID HE BUY A PAPER FOR
sample-000836.mp3,WILL YOU TRUST HIM THAT HE DOES IT RIGHT
sample-000837.mp3,YOU CAN COUNT ON ME UNDER ONE CONDITION
sample-000838.mp3,IT BROUGHT HIS HEART INTO HIS MOUTH
sample-000839.mp3,YOU R DEA FROLLED IN HIM
sample-000840.mp3,SOMEBODY'S DRYING THIS KID
sample-000841.mp3,THEN HE DROPPED HIS SPADE PICKED UP HIS JACKET AND CAME OUT INTO THE ROAD
sample-000842.mp3,AND FOR WISE MEN GOLD IS THE METAL THAT EVOLVED THE FURTHEST
sample-000843.mp3,THE FIRE BURNED THE FOX
sample-000844.mp3,WHEN I RETURNED TO THE COMMON THE SUN WAS SETTING
sample-000845.mp3,I DON'T UNDERSTAND WHAT YOU'RE TALKING ABOUT THE DESERT SAID
sample-000846.mp3,AND IN THAT MOOD HE WAS GRATEFUL TO BE IN LOVE
sample-000847.mp3,I AIN'T SEEN HIM FOR A WEEK
sample-000848.mp3,WHEN DOING REINFORCEMENT LEARNING WE HAVE TO FIND A SUITABLE TRADE OFF BETWEEN EXPLORATION AND EXPLOITATION
sample-000849.mp3,THEY FORGOT THAT LEAD COPPER AND IRON HAVE THEIR OWN DESTINIES TO FULFILL
sample-000850.mp3,FROM THE RAILWAY STATION IN THE DISTANCE CAME THE SAD OF TRAINS RINGING AND RUMBLING
sample-000851.mp3,THEY FORMED HEAPS THAT ARE VISIBLE A MILE AND A HALF WIYE
sample-000852.mp3,STADDY IN TROUBLE
sample-000853.mp3,RAT IS AN ANTELOPE MY SON
sample-000854.mp3,IT'S EXTREMELY SUSPICIOUS THAT THERE'S NO INFORMATION ABOUT BRAINS THAT DIDN'T COME FROM A BRAIN
sample-000855.mp3,THE BOY AWOKE BEFORE DAWN
sample-000856.mp3,IT'S EXTREMELY SUSPICIOUS THAT THERE'S NO INFORMATION ABOUT BRAINS THAT DIDN'T COME FROM A BRAIN
sample-000857.mp3,ONE CAN IMAGINE THESE TWO COVERED WILL SEND RUNNING UP THE LITTLE STREET AND THE BRIGHT SUNLIGHT
sample-000858.mp3,I FEEL LIKE A BOOT LUCKER
sample-000859.mp3,WHY DID YOU WANT TO SEE ME THE BOY ASKED
sample-000860.mp3,THAT'S WHY I'M QUETTING
sample-000861.mp3,WHO IS YOUR FAVORITE AUTHOR
sample-000862.mp3,OF COURSE WITH FEW WORDS UNABLE TO DO ANYTHING
sample-000863.mp3,THEY HARE POWERFUL FORCES ON BOTH SIDES AND THE WAR IS IMPORTANT TO BOTH ARMIES
sample-000864.mp3,WOULD YOU LIKE TO SEE WHERE I WAS TATTOOED
sample-000865.mp3,THERE ARE ONLY EIGHT FLAGS UP THERE NOW
sample-000866.mp3,IF A CAN CONCENTRATE ALWAYS ON THE PRESENT YOU'LL BE A HAPPY MAN
sample-000867.mp3,THE SHOP IS EXACTLY THE SIZED I ALWAYS WANTED IT TO BE
sample-000868.mp3,THE CROWD SWAYED A LITTLE AS I ELBOWED MY WAY THROUGH
sample-000869.mp3,THERE WERE RAISED VOICESAND SOME SORT OF STRUGGLE APPEARED TO BE GOING ON 
sample-000870.mp3,THE ARTICLE SHOULD CONTAIN YOUARE L FER THE DATA SET CAN BE DAWNLOADED
sample-000871.mp3,BUT HE'S ON THE RIGHT TRACK
sample-000872.mp3,I'VE HANDLED A GOOD MANY BIG PROMOTIONS IN MY TIME
sample-000873.mp3,IT'S ONLY A FEW BOTS MUMBLED OVER YOU BY A JUDGE
sample-000874.mp3,WE HAD TO RUSH DOWN THE MINUTE IT HAPPENED
sample-000875.mp3,HOW MUCH IS YOUR EQUITY IN I
sample-000876.mp3,WE CANNOT FORGET THAT FARCE
sample-000877.mp3,IF I HAD TOLD YOU YOU WOULDN'T HAVE SEEN A PYRAMIDS
sample-000878.mp3,BUT THERE WAS SOMETHING THERE IN HIS HEART THAT WOULDN'T ALLOW HIM TO DO SO
sample-000879.mp3,YOU SHOULDN'T BE HERE THE ALCHEMIST ANSWERED
sample-000880.mp3,AND HE WASN'T FARING MUCH BETTER
sample-000881.mp3,HE NOTICED THE UNEQUAL COOLING OF ITS SURFACE
sample-000882.mp3,THE BOY PUT THE STONES IN HIS POUCH
sample-000883.mp3,I'LL DO YOU LIKE IT
sample-000884.mp3,HOW STRANGE AFRICA IS THOUGHT THE BOY
sample-000885.mp3,IF I TOLD YOU IT MIGHT NOT COME TRUE
sample-000886.mp3,BUT MAYBE I'LL NEVER HAVE ANOTHER CHANCE TO GET TO THE PYRAMIDS IN EGYPT
sample-000887.mp3,HE CALLED TO THE BOY AND THEY TOOK A WALK ALONG THE DUNES SURROUNDING NUT ENCAMPMENT
sample-000888.mp3,IF A PERSON IS LIVING OUT HIS DESTINY HE KNOWS EVERYTHING HE NEEDS TO KDO
sample-000889.mp3,NO ONE SEEMED TO HAVE THOUGHT ABOUT IT THAT NIGHT
sample-000890.mp3,THEN ONE DAY THE BOY RETURNED THE BOOKS TO THE ENGLISHMAN
sample-000891.mp3,DIDN'T YOU TELL HER
sample-000892.mp3,HE DIDN'T KNOW THE MAN YET BUT HIS PRACTICED EYE WOULD RECOGNIZE HIM WHEN HE APPEARED
sample-000893.mp3,THE BATTLES MAY LAST FOR A LONG TIME PERHAPS EVEN YEARS
sample-000894.mp3,THE ALCHEMIST WAS A BIT DAUNTING BUT AS THE BOY DRANK THE WINE HE RELAXED
sample-000895.mp3,SO THE WIND BLEW WITH ALL ITS STRENGTH AND THE SKY WAS FILLED WITH SAND
sample-000896.mp3,I WANT TO SEE THE CHIEFTAINS
sample-000897.mp3,THEYRE TINIEST AV BEEN SOMEWHERE AROUND SIX O'CLOCK
sample-000898.mp3,IT'S USUALLY CUSTOMARY TO BRING THE MONEY WITH YOU
sample-000899.mp3,UPON RETURNING TO THE WISE MAN HE RELATED IN DETAIL EVERYTHING HE HAD SEEN
sample-000900.mp3,BUT HE APPEARED TO BE UNAWARE OF ANY DANGER
sample-000901.mp3,THAT WOMAN IS GOING NA BE ON THAT ROOF
sample-000902.mp3,THE FAMILIES WILL BE HERE SOON
sample-000903.mp3,EVERYONE WHEN THEY ARE YOUNG KNOWS WHAT THAT DESTINY IS
sample-000904.mp3,I'M GOING TO TELL YOUR MOTHER ON YOU
sample-000905.mp3,TWO DAYS LATER THE MERCHANT SPOKE TO THE BOY ABOUT THE DISP
sample-000906.mp3,THE ARROW WAS POINTING TO THE EXIT
sample-000907.mp3,WHAT IS IT ABOUT
sample-000908.mp3,THE BOY BECAME FEARFUL THE OMENS TOLD HIM THAT SOMETHING WAS WRONG
sample-000909.mp3,WE KNOW THAT AND WEARE USED TO IT
sample-000910.mp3,EVERYONE SEEMED VERY EXCITED
sample-000911.mp3,HE NEEDED SOMEONE TO TALK TO SO AS TOAVOID THINKING ABOUT THE POSSIBILITY OF WAR
sample-000912.mp3,THE NEWS WAS CHILLIN TO SAY THE LEAST
sample-000913.mp3,AT THAT POINT THE OMENS WILL TELL YOU THAT YOUR TREASURE IS BURIED FOREVER
sample-000914.mp3,IN SPITE OF THIS I STILL BELIEVED THAT THERE WERE MEN IN MARS
sample-000915.mp3,I'M SURE SHE'LL BE ALL RIGHT
sample-000916.mp3,THE DESERT WAS ONCE A SEA HE SAID
sample-000917.mp3,HE WANTED THEM TO BE A PARK OF HERE INHABITANCE
sample-000918.mp3,BESIDES THAT THERE WAS A HEAP OF BICYCLES
sample-000919.mp3,HE APPEARED WITH THE FAST TARS OF EVENING
sample-000920.mp3,I DIDN'T KNOW SHEPHERDS KNEW HOW TO READ SAID A GIRL'S VOICE BEHIND HIM
sample-000921.mp3,AND HE ASKED THE BOY IF HE TOO WERE IN SEARCH OF THE ALCHEMIS
sample-000922.mp3,THEN SUDDENLY THEY KNEEL AND DIE
sample-000923.mp3,I'M NOT GOING VERY FAR THE ALCHEMIST ANSWERED LOOKING STRAIGHT INTO THE EYES OF THE HORSEMEN
sample-000924.mp3,I WANTED TO SLEEP A LITTLE LONGER HE THOUGHT
sample-000925.mp3,IT'S A MAN WHO UNDERSTANDS NATURE AND THE WORLD
sample-000926.mp3,TURNING THE AIR CONDITIONING ON LEADS TO AN INCREASED FUEL CONSUMPTION
sample-000927.mp3,IT MUST HAVE FALLEN WHILE I WAS SITTING OVER THERE
sample-000928.mp3,NOT UNTIL THE MOON WAS HIGH DID THE ALCHEMIST RIDE INTO VIEW
sample-000929.mp3,THAT'S TRUE THE BOY THOUGHT
sample-000930.mp3,I WISHED I HAD A LIGHT TO SMOKE BY
sample-000931.mp3,IT'S THE PHILOSOPHY THAT GUARANTEES EVERYONE'S FREEDOM
sample-000932.mp3,I HAVE NO INFORMATION ABOUT TROOPS OR ABOUT THE MOVEMENT OF THE TRIBES
sample-000933.mp3,IF GOOD THINGS ARE COMING THEY WILL BE A PLEASANT SURPRISE SAID THE SEER
sample-000934.mp3,I WOULDN'T LIVE IN IT AS A GHOST
sample-000935.mp3,TELL YOUR HEART THAT THE FEAR OF SUFFERING IS WORSE THAN THE SUFFERING ITSELF
sample-000936.mp3,BUT THEY'RE SOMEBODY'S CHILDREN
sample-000937.mp3,AND THERE YOU WERE IM BED
sample-000938.mp3,THE HYDROGEN GAS ESCAPED
sample-000939.mp3,ONE CAN IMAGINE THESE TWO COVERED WITH SAND RUNNING UP A LITTLE STREET IN THE BRIGHT SUNRIGHT
sample-000940.mp3,THE TRIBAL CHIEFTAINS WILL SEE THAT AND YOU'LL BE DISMISSED FROM YOUR POSITION AS COUNSELOR
sample-000941.mp3,TOO BAD I COULDN'T SEE THE GUY FIRST
sample-000942.mp3,THE OLD MAN LEAFED THROUGH THE BOOK AND FELL TO READING A PAGE HE CAME TO H
sample-000943.mp3,ABOUT ELEVEN I WALKED BACK TO MY HOME IN MAYBURY BECAUSE NOTHING SEEMED TO BE HAPPENING
sample-000944.mp3,HE SAID HE COULDN'T HAVE HANDLED IT BETTER HIMSELF
sample-000945.mp3,I WONDER WHAT'S KEEPING MOTHER
sample-000946.mp3,ONE IS LOVED BECAUSE ONE IS LOVED
sample-000947.mp3,THE BOY AWOKE BEFORE DAWN
sample-000948.mp3,HE DECIDED TO STAY RIGHT THERE AND AWAIT HIS RETURN
sample-000949.mp3,THAT'S WHY I FEEL I DESERVE A PART OF WHAT YOU FIND
sample-000950.mp3,AS THE SUN ROSE THE MEN BEGAN TO BEAT THE BOY
sample-000951.mp3,THE TURF AND GRAVEL AROUND IT SEEMED CHARRED AS IF BY A SUDDEN EXPLOSION
sample-000952.mp3,WHAT DO YOU MEAN BY THAT
sample-000953.mp3,GIVEN ONLY THE PUBLIC KEY IT IS VERY HARD TO COMPUTE THE PRIVATE ONE
sample-000954.mp3,IT'S THEOASIS SAID A CAMEL DRIVER
sample-000955.mp3,WE HAVE ALSO STARTED CONTEMPLATING THE POSSIBILITY OF MOVING BACK TO COLORADO
sample-000956.mp3,THEY NEED WOR KILLING BESIDE A LAFE
sample-000957.mp3,AND HE LOOKED OUT OVER THE DESERT THAT HAD BROUGHT HIM ANTO THE WOMAN HE LOVED
sample-000958.mp3,SO YOU KNOW ABOUT LOVE THE BOY SAID
sample-000959.mp3,EVERY SEARCH BEGINS WITH BEGINNER'S LUCK
sample-000960.mp3,HE CAME TO UNDERSTAND ITS TARCHES AND TRAKES AND TO ACCEPT IT AS IT WAS
sample-000961.mp3,WHY YIVITE ME
sample-000962.mp3,THERE WAS A SMALL BUILDING THERE WITH A WINDOW AT WHICH PEOPLE ABOUT DICKETS TO A FRIKA
sample-000963.mp3,THE CARAVAN MOONED TOWARDS THE EAST
sample-000964.mp3,IT WAS SEEN ERRLY IN THE MORNING ROSSAN ROVER IS DRAND
sample-000965.mp3,NO ONE SEEMED TO HAVE THOUGHT ABOUT IT THAT NIGHT
sample-000966.mp3,BUT I'M GOING TO EAGH YT THE BOY SAID
sample-000967.mp3,YOULL RESENTED ME FROM THE FIRST MOMENT YOU SAW ME
sample-000968.mp3,THE SHEEP HAD TAUGHT HIM THAT
sample-000969.mp3,YOU DON'T HAVE TO APOLOGIZE
sample-000970.mp3,AND SUCKER FOR IT
sample-000971.mp3,THIS WAS MY DESTINY NOT YOURS THE ALCHEMIST ANSWERED
sample-000972.mp3,DARON NEVER SAW A BOTTLE TILL HE WAS SIX MONTHS OUD
sample-000973.mp3,I GOT DRUNK YESTERDAY AND THOUGHT I BUILT A SUPER COMPUTER
sample-000974.mp3,I MISSED YOU AND I COULDN'T CALL YOU BUT I TRIED
sample-000975.mp3,GET THE RIOT GEAR
sample-000976.mp3,HE CALLED TO THE BOY AND HIT TOOK A WALK ALONG THE DUNES UROUNDING THE ENCAPMENT
sample-000977.mp3,LIKE CRICKETS AND LIKE EXPECTATIONS LIKE LIZARDS AND FORELEAF CLOVERS
sample-000978.mp3,A LARGE PORTION OF THE CYLINDER HAD BEEN UNCOVERED
sample-000979.mp3,THE TURF AND GRAVEL AROUND IT SEEMED CHARRED AS IF BY A SUDDEN EXPLOSION
sample-000980.mp3,THEY SAY IT'S FAKE
sample-000981.mp3,THE BOY THOUGHT OF FATIMA
sample-000982.mp3,I WASN'T BORN YESTERDAY
sample-000983.mp3,JUST BY LOOKING AT THEM
sample-000984.mp3,BUKE I'M YOUR SISTAR
sample-000985.mp3,FOLK IS NOT MY FAVORITE MUSIC JONERA
sample-000986.mp3,NOBODY KNEW WHO ALCOLM WAS
sample-000987.mp3,MOST METEURUITS ARE MORE OR LESS ROUNDED
sample-000988.mp3,I WANT THEM BOTH ARRESTED
sample-000989.mp3,WE MISS YOU AND MISS HAVING A FRIEND LIKE YOU AND IAM SO HAPPY THE JUTES YOU GOT TO CATCH UP
sample-000990.mp3,THE TRIBAL CHIEFTAIN CALLED FOR THE BOY WHO PRESENTED HIM WITH FIFTY PIECES OF GOLD
sample-000991.mp3,HALF AN HOUR LATER HIS SHOVEL HIT SOMETHING SOLID
sample-000992.mp3,I HAVE ALREADY DESCRIBED THE APPEARANCE OF THAT COLOSSAL BOOK WHICH WAS EMBEDDED IN THE GROUND
sample-000993.mp3,I THOUGHT YOU WERE GOING TO TEACH ME SOME OF THE THINGS YOU KNOW
sample-000994.mp3,'EVERYONE LAUGHED THEM AND ENJOYED THEM
sample-000995.mp3,SOME WENT AWAY WHILE I WAS THERE AND OTHER PEOPLE CAME
sample-000996.mp3,WEARING HIS NEW SANDALS HE DESCENDED THE STAIRS SILENTLY
sample-000997.mp3,THESE ARE NOT CAMELS
sample-000998.mp3,HE HEARD A MUFFLED GRATING SOUND AND SAW THE BLACK MARK JERK FORWARD AN INCH OR SO
sample-000999.mp3,HE BEGAN TO DIG AT THE BASE OF THE SYCAMORE
sample-001000.mp3,I TOLD YOU I CAN'T USE TOU FALLEN ANYMOR
sample-001001.mp3,I GOT DRUNK YESTERDAY AND THOUGHT I BUILT A SUPER COMPUTER
sample-001002.mp3,YOU CAN GET AROUND VERY EASILY BY TRAIN WHICH IS A VERY RELAXING AND AFFORDABLE WAY TO TRAVEL
sample-001003.mp3,HE NOTICED THE UNEQUAL COOLING OF ITS SURFACE
sample-001004.mp3,UPON RECHARNING TO THE WISE MAN HE RELATED IN DETAIL EVERYTHING HE HAD SEEN
sample-001005.mp3,YOU CAN DO A LOT JUST USING YOUR VOICE BUT THERE ARE STILL A FEW TIMES YOU'LL FIND YOURSELF REACHING FOR A MOUSE
sample-001006.mp3,YOU POINT TO A TRAILOW OF ANTS LEADING INTO THE HOUSE
sample-001007.mp3,MECCA IS A LOT FURTHER AWAY THAN THE PYRAMIDS
sample-001008.mp3,AS HE WATCHED THE PLANE IT SEEMED TO GROW LARGER ANCE MORE
sample-001009.mp3,YOU ARE THE ONLY ONE WHO COULD HAVE IT
sample-001010.mp3,BUT NOW I'M SAD AND ALONE
sample-001011.mp3,OF COURSE THE TWO WERE UNABLE TO DO ANYTHING
sample-001012.mp3,DON'T YOU KNOW ME
sample-001013.mp3,YOU WILL NEVER REOPEN
sample-001014.mp3,I'VE HAD THIS SHOP FOR THIRTY YEARS
sample-001015.mp3,JARGE AM I NOW THINKS UT
sample-001016.mp3,MY DOG GAVE A LIFE TO SAVE MY CHILD
sample-001017.mp3,DON'T TRY TO ENTER INTO THE LIFE OF THE OASIS
sample-001018.mp3,THE TREASURE IS AT THE PYRAMIDS THAT YOU ALREADY KNEW
sample-001019.mp3,I DON'T BLAME YOU
sample-001020.mp3,CURSE THE MOMENT I MET THAT OLD MAN HE THOUGHT
sample-001021.mp3,THE SOUL OF THE WORLD IS NOURISHED BY PEOPLE'S HAPPINESS
sample-001022.mp3,THERE WERE RAISED VOICESAND SOME SORT OF STRUGGLE APPEARED TO BE GOING ON 
sample-001023.mp3,THE ERWARD WEARY I THINK TWO OR THREE HUNDRED PEOPLE ALWOING ONE OF THEM THER
sample-001024.mp3,THE SNAKES LITTERED TOWARD THE SHADED BOULDERS UNDER THE CLIFF
sample-001025.mp3,FROM HERE ON YOU BE ALONE THE ALCHEMIST SAID
sample-001026.mp3,THE BOY REMEMBERED HIS DREAM AND SUDDENLY EVERYTHING WAS CLEAR TO HIM
sample-001027.mp3,IT WAS A PLEASANT CHANGE FROM TURKINGTON'S SOUT
sample-001028.mp3,AND HE ASKED THE BOY IF HE TWO WERE IN SEARCH OF THE ALCHEMIST
sample-001029.mp3,I'LL WORK ALL NIGHT UNTIL DAWN AND I'LL CLEAN EVERY PIECE OF CRYSTAL IN YOUR SHOP
sample-001030.mp3,WE'RE NOT ALLOWED TO TELL
sample-001031.mp3,HE WASN'T FARING MUCH BETTER
sample-001032.mp3,BUT THEY WERE NOT THERE
sample-001033.mp3,DON'T YOU KNOW THERE ARE NINE JOPS WAITING FOR THIS GUY
sample-001034.mp3,NO THAT'S NOT WHAT I MEAN
sample-001035.mp3,MOM TOOK GRANDMA TO THE GARDEN CENTER TO HEAR THE LATTER NAMES OF PLANTS
sample-001036.mp3,SANGA READ ALOUD THE STRANGE EXCERPT
sample-001037.mp3,THERE WAS ABSOLUTELY NO REASON FOR HER TO ANNOUNCE IT TO THE ENTIRE COM
sample-001038.mp3,THE CRIMINALS FONTED THE POLICE OF THE SUSAN PRISON TER
sample-001039.mp3,AND IN THAT WAY THE MONTHS PASSED
sample-001040.mp3,THE BOY BEGAN AGAIN TO READ HIS BOOK BUT HE WAS NO LONGER ABLE TO CONCENTRATE
sample-001041.mp3,CAN YOU IMAGINE THAT THAT'S A CREY
sample-001042.mp3,IN SOME PLACES THE GROUND WAS COVERED WITH THE SALT OF DRIEDUP LAKES
sample-001043.mp3,THEY WENT IN TO DRINK THE TEA WHICH WAS SERVED IN BEAUTIFUL CRYSTAL GLASSES
sample-001044.mp3,BY IS CERTAIN THE SORTE AS
sample-001045.mp3,STARTING WITH HIS OWN
sample-001046.mp3,THAT'S WHY I KEEP LOSING
sample-001047.mp3,WHAT HAD BEEN NEXT TO HIM FIVE MINUTES AGO WAS NOW AT THE OTHER SIDE
sample-001048.mp3,I DON'T TRUST ANYBODY
sample-001049.mp3,I'LL WORK ALL NIGHT UNTIL DAWN AND I'LL CLEAN EVERY PIECE OF CRYSTAL IN YOUR SHOP
sample-001050.mp3,BUT ARMS CANNOT BE DRAWN UNLESS THEY ALSO GO INTO BATTLE
sample-001051.mp3,BUT MOST THEY THOUGHT THAT ANOTHER METEORITE HAD DESCENDED
sample-001052.mp3,HE WANTED TO FORGET ABOUT THE VISION AND RETURN TO HIS MEDITATION
sample-001053.mp3,THE BOY PUT THE STONES IN HIS POUCH
sample-001054.mp3,THAT HE WANTED TO TRAVEL
sample-001055.mp3,I WENT STRETCHING MY LEGS CLUMSILY AND FEELING MY WAY INTO THE DARK
sample-001056.mp3,BUT THEN I REALIZED SHE COULDN'T HAVE BEEN
sample-001057.mp3,IF A PERSON IS LIVING OUT HIS DESTINY HE KNOWS EVERYTHING HE NEEDS TO KNOW
sample-001058.mp3,JUST A MEMORY RIGHT NOW IT SIGNIFIED SHADE WATER AND A REFUGE FROM THE WAR
sample-001059.mp3,THEY HAVE A CHEAP SAUSAGE AND FRIES OF THE BREWERIE TOMORROW
sample-001060.mp3,THEY'RE NOT MY SHEEP ANYMORE HE SAID TO HIMSELF WITHOUT NESTALGIAH
sample-001061.mp3,MAYBE THIS IS AN OMEN SAID THE ENGLISHMAN HALF ALOUD
sample-001062.mp3,THEY SEEMED TO LAUGH AT HIM AND HE LAUGHED BACK HIS HEART BURSTING WITH JOY
sample-001063.mp3,LASER TAG IS A GAME QUITE SIMILAR TO PAINTBALL
sample-001064.mp3,WHO'D YOU SAY IT WAS
sample-001065.mp3,YOU CAN'T GO ANY FARTHER ONE OF THEM SAID
sample-001066.mp3,I DO WON'T BELIEVE IT
sample-001067.mp3,BUT HE DIDN'T NEED TO WORRY ABOUT THAT RIGHT NOW
sample-001068.mp3,THE BOY DIDN'T KNOW WHAT TO SAY
sample-001069.mp3,EVIDENTLY WHERE THE FLOOR SHOW
sample-001070.mp3,IT'S NOT I THE WIND SPOKE ABOUT
sample-001071.mp3,THE BOY STEPPED CLOSER TO THE GIRL AND WHEN SHE SMILED HE DID THE SAME
sample-001072.mp3,THE BOY DO DDN'T KNOW WHAT TO SAID
sample-001073.mp3,CAN YOU GET IN THIS DESK
sample-001074.mp3,ELIE WAN FIRST BRICE IN THE SPENNING COMPETITION
sample-001075.mp3,WE DON'T KNOW WHAT'S IN THE CONFIDED THING DO YOU
sample-001076.mp3,BUT THE MERCHANT UNDERSTOOD WHAT THE BOY HAD SAID
sample-001077.mp3,I HEARD A PECULIAR HUMMING SOUND FROM THE PIT
sample-001078.mp3,THEY CAN'T HELP THEMSELVES
sample-001079.mp3,ON THE FIRST DAY HE RETURNED WITH A RABBIT AND ON THE SECOND WITH TWO BIRDS
sample-001080.mp3,THE GUY THOUGHT HE WAS A LUNATIC AT LARGE AND MADE AN UNSUCCESSFUL ATTEMPT TO STOP HIM
sample-001081.mp3,THERE WAS VERY LITTLE TALKING
sample-001082.mp3,I'M AN ALCHEMIST SIMPLY BECAUSE I'M AN ALCHEMIST HE SAID AS HE PREPARED THE MEAL
sample-001083.mp3,BUT THEY DON'T COUNT
sample-001084.mp3,ONLY CHRIS COULDN'T WAIT QUITE AS LONG AS THE OTHERS
sample-001085.mp3,NOW I WANT YOU TO SIGN THIS AGREEMENT
sample-001086.mp3,I REALLY DID IT QUITE BRILLIANTLY
sample-001087.mp3,HOLD ON A MINUTE
sample-001088.mp3,SUDDENLY HE DISAPPEARED AND I COULD HEAR A FAINT SHRIEK BEHIND THE WALLS
sample-001089.mp3,WHERE DO YOU LIVE SHOUTED THE BOY AS THE HORSEMAN RODE AWAY
sample-001090.mp3,AND HE ASKED THE BOY IF HE TOO WERE IN SEARCH OF THE ALCHEMIST
sample-001091.mp3,HE CAME TO UNDERSTAND ITS DODGES AND TRICKS AND TO ACCEPT IT AS IT WAS
sample-001092.mp3,YOU LIVED YOUR LIFE IN A LOVING WAY AND DIT WITH DEGINITY
sample-001093.mp3,BE CAREFUL WITH YOUR PROGNOSTICATIONS SAID THE STRANGER
sample-001094.mp3,AN LD WAS INDICATING THE PROXIMITY DETECTOR WAS WORKING PROPERLY
sample-001095.mp3,THAT'S WHAT KILLED HIM
sample-001096.mp3,AS SOON AS HE SAW ME AMONG THE CROWD HE CALLED TO ME TO COME DOWN
sample-001097.mp3,THERE WAS A TIME WHEN FOR MA A CAMEL'S WHINNYING WATH NOTHING MORE THAN WHINNYING
sample-001098.mp3,YOU HAVE BEEN STOPPING ME
sample-001099.mp3,I'M GOING TO THEM
sample-001100.mp3,THE ALCHEMIST WAS A BIT DAUNTING BUT AS THE BOY DRAGKED THE BINE ITA LAGE
sample-001101.mp3,THE STRANGER WAS SPEAKING OF THINGS THAT VERY FEW PEOPLE KNEW ABOUT
sample-001102.mp3,HIRES TWO PERSONAL TRAINERS AND MAKE ONE OF THEM TRAIN THE OTHER ONE
sample-001103.mp3,WHAT'S THE WORLD'S GRATEST LIE THE BOY ASKED COMPLETELY SURPRISED
sample-001104.mp3,THEY DIDN'T HAVE THE PRINTING PLACE IN THOSE DAYS</s>THE BOY ARGUE
sample-001105.mp3,BUT THE MERCHANT UNDERSTOOD WHAT THE BOY HAD SAID
sample-001106.mp3,THROUGHOUT THE ENTIRE DAY WE WILL BE ON THE LOOKOUT FOR OUR ENEMIES
sample-001107.mp3,THE EDERSON WAS A BOAT AND DELIGHTED ALL OF ROME WITH HIS BEAUTIFUL VASES
sample-001108.mp3,I'M GOING TO THEM
sample-001109.mp3,YOU'RE THE WOKE OF THE WOOLD
sample-001110.mp3,YOU SHOULD HAVE VALUATED IN A PERCEPTUAL EXPERIMENT
sample-001111.mp3,THEY'D NEVER LET YOU GO
sample-001112.mp3,EVEN THEN HE HARDLY UNDERSTOOD WHAT THIS MEANT
sample-001113.mp3,THEY RETURNED TO THE GATES OF THE MONASTERY
sample-001114.mp3,BUT THE ALCHEMIST CONTINUED TO LOOK TO THE HORIZON
sample-001115.mp3,THANK YOU VERY MUCH
sample-001116.mp3,SCATTERED GROUPS OF PEOPLE WERE HURRYING FROM THE DIRECTION OF WOLKIN
sample-001117.mp3,HE HAD DONE THIS FOR YEARS AND KNEW THE SCHEDULE OF EVERYONE WHO PASSED
sample-001118.mp3,THAT'S ALL MARK EVER TALKS ABOUT
sample-001119.mp3,IT BROUGHT IS HART HINTO HIS MOUTH
sample-001120.mp3,THE BURNING FIRE HAD BEEN EXTINGUISHED
sample-001121.mp3,HE LIVES AT THE EL FAYOUM OASIS HIS FRIEND HAD SAID
sample-001122.mp3,HEASAN EN SHORTIN'S BUSINESS
sample-001123.mp3,THEY DOWEVARGED WARNINGS ABOUT FIEVIS AND BARBARIAN TRIBES
sample-001124.mp3,THEY WERE KNOWN AS SEERS AND THEY WERE HELD IN FEAR BY WOMAN AND THE EL DELY
sample-001125.mp3,MOST OF THEM WERE STARING QUIETLY AT THE BIG TABLE
sample-001126.mp3,LOVE IS THE FALCON'S FLIGHT OVER YOUR SANDS
sample-001127.mp3,ABSOLUTELY DESPICABLE THAT GINGERBREAD MEN ARE FORCED TO LIVE IN HOUSES MADE OF THEIR OWN FLESH
sample-001128.mp3,FROM THEN ON HE WOULD MAKE HIS OWN DECISIONS
sample-001129.mp3,I HOLD THE POWER OF LIFE AND DEATH FOR EVERY PERSON I TAKE WITH ME
sample-001130.mp3,I HEARD A PECULIAR HUMMING SOUND FROM THE PIT
sample-001131.mp3,YOU KNEW THE WHOLE STORY
sample-001132.mp3,HE WAS ABOUT THE SAME AGE AND HATE AS THE BOY
sample-001133.mp3,MOLLABAT THESE INVISIBLE COSMIC CONNECTIONS THAT TRANSCEND TAME AND
sample-001134.mp3,DOWN BELOW IN THE DARKNESS WERE HUNDREDS OF PEOPLE SLEEPING IN PEACE
sample-001135.mp3,THEN SUDDENLY HE NOTICED IT WITH A START
sample-001136.mp3,THAT IS AN ANTELOPE MY SON
sample-001137.mp3,I SHALL MAKE US SOME ICE CUBES
sample-001138.mp3,THEN THE THING CAME UPON HIM IN A FLASH
sample-001139.mp3,IT HELPED ME TO TRUST IN PEOPLE THE ENGLISHMAN ANSWERED
sample-001140.mp3,I HAVE HAD THE SAME DREAM TWICE HE SAID
sample-001141.mp3,I DON'T TRUST ANYONE WHO SAYS THEY'VE NEVER HAD HAMBURGER ELFUR
sample-001142.mp3,BECAUSE YOU ARE TRYING TO REALIZE YOUR DESTINY
sample-001143.mp3,MANY TELESCOPES WERE POINTED AT IT
sample-001144.mp3,HE GOT UP EARLY WITH THE IDEA OF FINDING IT
sample-001145.mp3,DID YOU WANT TO SEE HER ABOUT SOMETHING IMPORTANT
sample-001146.mp3,SAYS FARAGE TO GO THE LIMUT
sample-001147.mp3,HE HAD FOUND WHAT HIS TREASURE WAS AND WAS FRIGHTENED AT WHAT MIGHT HAPPEN
sample-001148.mp3,WHAT ARE YOU DOING THERE
sample-001149.mp3,I'M YOUR GUARDIAN ANGEL
sample-001150.mp3,BUT HORSES TIRED BIT BY BIT
sample-001151.mp3,THE OLD MAN KNEW HOW TO READ AND HAD ALREADY READ THE BOOK
sample-001152.mp3,THE SUSPENSION BRIDGE WAS SWINGING IN THE GALE
sample-001153.mp3,THERE HAS BEEN A ROBBERY AT THE BURGLER SHOP IN DOWNTOWN
sample-001154.mp3,SHE KEEPS SAYING THAT SHE HAS NO REGRETS ABOUT MOVING BACK HOME BUT I'M NOT SURE IF ITS ENTIRELY TRUE
sample-001155.mp3,HE'S AFTER THE MONEY
sample-001156.mp3,DON'T ASK ME WHY I DON'T KNOW WHY
sample-001157.mp3,WHEN HE WAS A CHILD THAT MAN WANTED TO TRAVEL TO
sample-001158.mp3,SO HOW WILL WE NAME ALL THESE HURRICANES
